{
  "$schema": "https://json-schema.org/draft/2020-12/schema",
  "additionalProperties": false,
  "description": "Data of one instrument at one broker.",
  "properties": {
    "version": {
      "const": 1,
      "title": "Version",
      "type": "integer"
    },
    "kind": {
      "const": "instrument",
      "title": "Kind",
      "type": "string"
    },
    "broker": {
      "maxLength": 128,
      "minLength": 1,
      "pattern": "^\\S(?:[^\\x00-\\x1f\\x7f]*\\S)?$",
      "title": "Broker",
      "type": "string"
    },
    "instrument": {
      "maxLength": 128,
      "minLength": 1,
      "pattern": "^\\S(?:[^\\x00-\\x1f\\x7f]*\\S)?$",
      "title": "Instrument",
      "type": "string"
    },
    "acquired_at": {
      "description": "Moment the data was obtained from the broker.",
      "pattern": "^\\d{4}-\\d{2}-\\d{2}T\\d{2}:\\d{2}:\\d{2}(\\.\\d{1,6})?Z$",
      "title": "Acquired At",
      "type": "string"
    },
    "tick_size": {
      "exclusiveMinimum": 0,
      "title": "Tick Size",
      "type": "number"
    },
    "tick_value": {
      "description": "Value of one tick per lot.",
      "exclusiveMinimum": 0,
      "title": "Tick Value",
      "type": "number"
    },
    "tick_value_currency": {
      "pattern": "^[A-Za-z0-9]{2,10}$",
      "title": "Tick Value Currency",
      "type": "string"
    },
    "point": {
      "exclusiveMinimum": 0,
      "title": "Point",
      "type": "number"
    },
    "pip": {
      "exclusiveMinimum": 0,
      "title": "Pip",
      "type": "number"
    },
    "spread": {
      "description": "Usual spread as price difference.",
      "minimum": 0,
      "title": "Spread",
      "type": "number"
    },
    "min_volume": {
      "exclusiveMinimum": 0,
      "title": "Min Volume",
      "type": "number"
    },
    "volume_step": {
      "exclusiveMinimum": 0,
      "title": "Volume Step",
      "type": "number"
    },
    "contract_size": {
      "exclusiveMinimum": 0,
      "title": "Contract Size",
      "type": "number"
    },
    "swap_long": {
      "description": "Swap per lot and day for long positions.",
      "title": "Swap Long",
      "type": "number"
    },
    "swap_short": {
      "description": "Swap per lot and day for short positions.",
      "title": "Swap Short",
      "type": "number"
    },
    "swap_triple_weekday": {
      "description": "Weekday with the triple swap.",
      "enum": [
        "monday",
        "tuesday",
        "wednesday",
        "thursday",
        "friday",
        "saturday",
        "sunday"
      ],
      "title": "Swap Triple Weekday",
      "type": "string"
    },
    "margin_per_lot": {
      "anyOf": [
        {
          "minimum": 0,
          "type": "number"
        },
        {
          "type": "null"
        }
      ],
      "default": null,
      "description": "Margin requirement per lot, if the source delivers it.",
      "title": "Margin Per Lot"
    }
  },
  "required": [
    "version",
    "kind",
    "broker",
    "instrument",
    "acquired_at",
    "tick_size",
    "tick_value",
    "tick_value_currency",
    "point",
    "pip",
    "spread",
    "min_volume",
    "volume_step",
    "contract_size",
    "swap_long",
    "swap_short",
    "swap_triple_weekday"
  ],
  "title": "InstrumentDocument",
  "type": "object"
}
